{
  "name": "THE CENTERLAEND",
  "height": 10,
  "width": 10,
  "startFields": [
    {
      "position": [3, 9],
      "direction": "NORTH"
    },
    {
      "position": [4, 8],
      "direction": "NORTH"
    },
    {
      "position": [5, 8],
      "direction": "NORTH"
    },
    {
      "position": [6, 9],
      "direction": "NORTH"
    }
  ],
  "checkPoints": [
    [0, 0],
    [9, 9]
  ],
  "eye": {
    "position": [4, 9],
    "direction": "NORTH"
  },
  "holes": [
    [3, 4],
    [6, 3]
  ],
  "riverFields": [
    {
      "position": [1, 2],
      "direction": "EAST"
    },
    {
      "position": [1, 3],
      "direction": "EAST"
    },
    {
      "position": [1, 4],
      "direction": "EAST"
    },
    {
      "position": [1, 5],
      "direction": "EAST"
    },
    {
      "position": [1, 6],
      "direction": "EAST"
    }
  ],
  "walls": [
    [
      [0, 5], [1, 5]
    ],
    [
      [1, 1], [2, 1]
    ],
    [
      [2, 1], [2, 2]
    ],
    [
      [4, 4], [5, 4]
    ],
    [
      [4, 6], [4, 7]
    ],
    [
      [5, 2], [5, 3]
    ],
    [
      [5, 6], [5, 7]
    ],
    [
      [7, 9], [8, 9]
    ]
  ],
  "lembasFields": [
    {
      "position": [0, 9],
      "amount": 6
    },
    {
      "position": [9, 0],
      "amount": 6
    }
  ],
  "eagleFields": [
    [1, 1],
    [9, 9],
    [9, 1]
  ]
}